{
  "$schema": "https://json-schema.org/draft/2020-12/schema",
  "$id": "https://moment-one.dev/contracts/schemas/moment.v1.json",
  "title": "Moment Domain v1",
  "description": "Unified Moment domain model shared across Server, Web, and Glasses.",
  "type": "object",
  "required": [
    "id",
    "userId",
    "title",
    "category",
    "occurredAt",
    "timezone",
    "revision",
    "createdAt",
    "updatedAt"
  ],
  "properties": {
    "id": {
      "type": "string",
      "format": "uuid",
      "description": "Globally unique identifier. Client-generated for offline-first sync."
    },
    "userId": {
      "type": "string",
      "description": "Server-side internal user ID. Local MVP uses 'local-user'."
    },
    "title": {
      "type": "string",
      "maxLength": 20,
      "description": "Short title, typically AI-generated or derived from voice input."
    },
    "description": {
      "type": ["string", "null"],
      "maxLength": 240,
      "description": "Longer description of the moment."
    },
    "voiceInput": {
      "type": ["string", "null"],
      "description": "Original voice transcription that triggered the record."
    },
    "aiSummary": {
      "type": ["string", "null"],
      "maxLength": 80,
      "description": "AI-generated summary for quick recall."
    },
    "category": {
      "type": "string",
      "enum": ["experience", "habit", "travel", "food", "growth", "emotion"],
      "description": "Primary category for the moment."
    },
    "tags": {
      "type": "array",
      "items": { "type": "string" },
      "maxItems": 5,
      "description": "User or AI assigned tags, deduplicated, max 5."
    },
    "occurredAt": {
      "type": "string",
      "format": "date-time",
      "description": "When the moment occurred (user-local time)."
    },
    "timezone": {
      "type": "string",
      "description": "IANA timezone, e.g. 'Asia/Shanghai'."
    },
    "location": {
      "type": ["object", "null"],
      "properties": {
        "name": { "type": "string" },
        "latitude": { "type": "number" },
        "longitude": { "type": "number" },
        "source": {
          "type": "string",
          "enum": ["device", "user", "mcp", "unknown"],
          "default": "unknown"
        }
      },
      "additionalProperties": false
    },
    "emotion": {
      "type": ["object", "null"],
      "properties": {
        "label": { "type": "string", "maxLength": 12 },
        "source": {
          "type": "string",
          "enum": ["user", "inferred"],
          "description": "user = confirmed by user, inferred = AI-generated."
        },
        "valence": {
          "type": "number",
          "minimum": 0,
          "maximum": 1,
          "description": "Positive/negative dimension. 0 = neutral, 1 = very positive. Optional, for future expansion. Note: v1 uses 0-1 (not traditional -1..+1) for simpler client implementation; negative valence is not represented in v1."
        },
        "arousal": {
          "type": "number",
          "minimum": 0,
          "maximum": 1,
          "description": "Calm/excited dimension. 0 = calm, 1 = very excited. Optional, for future expansion."
        }
      },
      "required": ["label", "source"],
      "additionalProperties": false
    },
    "provenance": {
      "type": ["object", "null"],
      "description": "Moment origin info. Immutable after creation. Used for audit and data lineage.",
      "properties": {
        "source": {
          "type": "string",
          "enum": ["rokid", "mobile", "web", "agent", "mcp", "import"]
        },
        "deviceId": { "type": "string", "description": "Device ID for device-originated Moments (e.g. Rokid glasses). Links to device_bindings table." },
        "clientId": { "type": "string" },
        "mcpServerId": { "type": "string" },
        "mcpToolName": { "type": "string" },
        "externalId": { "type": "string" }
      },
      "required": ["source"],
      "additionalProperties": false
    },
    "media": {
      "type": "array",
      "description": "Read-only media snapshot populated by server on read. Empty on write (use assetIds).",
      "items": {
        "type": "object",
        "properties": {
          "assetId": { "type": "string" },
          "type": { "type": "string", "description": "MIME type, e.g. image/jpeg" },
          "thumbnailUrl": { "type": ["string", "null"], "description": "Short-lived signed URL for thumbnail. Null for media types without thumbnails (e.g. audio)." },
          "downloadUrl": { "type": "string", "description": "Short-lived signed URL for original. Only in detail responses." },
          "expiresAt": { "type": "string", "format": "date-time" }
        },
        "required": ["assetId", "type"],
        "additionalProperties": false
      }
    },
    "revision": {
      "type": "integer",
      "minimum": 0,
      "description": "Optimistic lock revision. 0 for pending local, incremented on each server update."
    },
    "syncState": {
      "type": "string",
      "enum": ["pending", "synced", "conflict"],
      "description": "CLIENT-ONLY field for offline sync. Never persisted on server, never returned in server API responses. Glasses/local clients use this to track sync state. Excluded from server responses per ADR-0002."
    },
    "createdAt": {
      "type": "string",
      "format": "date-time"
    },
    "updatedAt": {
      "type": "string",
      "format": "date-time"
    },
    "deletedAt": {
      "type": ["string", "null"],
      "format": "date-time",
      "description": "Tombstone timestamp. null for active moments."
    }
  },
  "additionalProperties": false,
  "$comment": "v1 fields are frozen. syncState is client-only and excluded from server responses. New fields require an ADR and schema version bump."
}
