{
  "id": "b2c3d4e5-2345-6789-abcd-ef0123456789",
  "userId": "00000000-0000-4000-8000-000000000001",
  "title": "吃了一碗面",
  "description": "在公司楼下面馆吃了一碗牛肉面，味道不错。",
  "voiceInput": "刚在公司楼下吃了一碗面",
  "aiSummary": "在公司楼下面馆吃牛肉面",
  "category": "food",
  "tags": ["美食", "面馆"],
  "occurredAt": "2026-07-28T12:15:00.000Z",
  "timezone": "Asia/Shanghai",
  "location": {
    "name": "公司楼下",
    "source": "user"
  },
  "emotion": {
    "label": "开心",
    "source": "user",
    "valence": 0.7,
    "arousal": 0.3
  },
  "provenance": {
    "source": "rokid",
    "deviceId": "RKID-A1B2-C3D4-E5F6",
    "clientId": "rokid-glasses-001"
  },
  "revision": 2,
  "createdAt": "2026-07-28T12:15:10.000Z",
  "updatedAt": "2026-07-28T18:00:00.000Z",
  "deletedAt": null
}
